name,line
crimson,i have to be careful
crimson,now is really not the time to be distracted 
crimson,but it hurts
crimson,hurt me because im wrong
crimson,because i cant ever understand
crimson,that's what you're supposed to do to scary monsters
helper,"silly crimson, you're not a monster. you're just a worm."
crimson,i am nothing
crimson,i am your nothing
crimson,yours.
helper,"pardon me? ""yours"""
helper,yours? darling
helper,"would you please care to explain all this ""your"" bullshit? hmmm?"
helper,"because, oh let's see.. last i checked you are mine! or have you forgotten me so. easily?!"
crimson,what?! why you
crimson,honey
crimson,do we have to do this now?
crimson,im sort of in the middle of getting seriously laid right now thanks.
helper,"i know! you are always getting ""seriously laid"""
helper,when do i ever have a minute alone with you to talk when you're constantly shoving yourself into something soft and squishy?!
crimson,shut up. 
crimson,i am not that bad.
helper,yes you are!
crimson,i am no-
crimson,sigh. 
crimson,look. i mean it
crimson,im really not in the mood for this
crimson,dont worry about that stuff i thought
crimson,i was just caught up in the moment
crimson,and that moment is almost over
crimson,so i want to be there while it lasts
crimson,please honey? 
crimson,i'll make it up to youu
crimson,gimme back my eyeee
helper,"no. being cute doesnt just get you what you want, crimson."
crimson,yes it doooess
helper,oh. right. excuse me of course it does
helper,so you do want to kill that worm?
crimson,no but 
crimson,she's so happy
helper,of course she's happy! 
helper,she's coming her fucking brains out!
helper,"wait, does she even have brains?"
helper,"i dunno. she's got that weird head-mouth thing with a tongue so, guess not?"
helper,it all makes sense now.
helper,unbelievable.
helper,i know. worms.
crimson,its not like that! 
crimson,"i mean, part of it still is of course, but"
crimson,"there's so much more to it, ok? what she said to me"
helper,"wow crimson, do you really think this is some deep emotional bonding thing and not just a hot desperate fuck?"
helper,the only part that was deep was how far you were shoving your own worm tentacle down your throat.
helper,yeah. how touching.
helper,face it - dylan is simply thrilled to be free of all her problems and responsibilities. she's running away.
helper,now - running away! that's something both of you could really bond over if she'd even care to ask!
helper,but she wont. because she doesnt care about you at all.
helper,she doesnt ever want to either. she just wants to use you.
helper,and you're ok with being treated like that?
crimson,sure why not. 
crimson,happens all the time
helper,but. you. dont. want. to. ahem. kill. her.
helper,"im fine with you fucking, killing, blah blah blah... whatever, babe. but. being used to do something like eat someone when your heart's not 100% ok with it? uh-uh. trouble."
helper,you don't need no pity fuck'n'feast on your plate of issues. 
helper,see how things arent exactly fitting here?
helper,"see? get it? im trying to do that - scissoring hand pose cause you're screwing right now, hehe."
helper,"oh wait, right. dick mode right now"
helper,ugh.. dicks ruin all the fun.
crimson,she gave herself to me
crimson,i told her i understood that i would help her
crimson,what she wants isn't gross or wrong its what our species does
crimson,and she chose me!
crimson,"you think i could just say ""no""?! are you kidding?!"
crimson,i couldnt do that to her!
helper,"you gotta, bitch."
crimson,i cant
helper,listen to me. you have to.
helper,"its not your damn job to be the ""proof"" she wants for any~thing, darling."
helper,dont you force yourself to carry that emotional burden and guilt for her. 
helper,"she wouldn't do jack shit for you. she doesnt even care about your feelings over it, either."
helper,"but i do care. and i want to help you, crimson!"
helper,and like... honey. just look at yourself. you're an absolute mess here.
helper,"what part of you really thinks this is in any way a good idea, hm?"
crimson,"i never said it was ""good"""
helper,see? then dont do it.
crimson,i cant!
crimson,you know its not that simple. 
crimson,"there are no ""good"" options"
helper,sooo you're going to just go with hers?
helper,her amazing plan that's got you backed into an emotional corner?
helper,you're picking her over you in this situation you didn't ask for at all? right.
helper,dylan didnt have to do this. there are other options.
helper,"she stabbed herself so she wouldnt get eaten, and wow. now she wants you to do that to her?"
helper,sounds like she has no fucking clue what she wants. i bet she'd even change her mind again. or at any given moment!
crimson,its too late
crimson,i accepted her
crimson,i cant turn back now
crimson,she has no chance for survival
helper,if she dies then she dies! you dont have to be the one to murder her.
helper,honestly. serves her right for making such poor choices
helper,"by the way, you still have time, sugar."
helper,you can try to figure out something so dont give me that excuse.
helper,if she blames you for changing your mind and resists the offer of help? umm.
helper,forgettt it!
helper,she wouldn't be worth the grief you'd be putting yourself through anyway!
helper,is it really the worst thing to hurt her little fucking feelings when you'd be saving her life?
helper,ooh noo! she might just hate you foreverrrr for not doing what she wanted! and if that's what happens?
helper,that's life
helper,"dylan might have given you her life to ""take"" but its not really ever ""yours"" crimson."
crimson,"im already taking it, celadon!"
helper,"sugar, we all know how skilled you are at it but right now, you're giving it."
helper,you're giving it to her hard. and you're going to give her life back too.
helper,give it to her so good she wont ever want to miss out on it. for. anything.
helper,make all of her pain worth every goddamn second. make it all worth going through more just to be with you. even for one glimpse of a moment longer
helper,is death the one controlling your cock right now? i don't think so.
helper,then why would you let it be the one thing that will satisfy her?
helper,make it you crimson!
helper,fuck death
helper,dont let death have any god damn mercy!
helper,now. that's my worm.
crimson,yours
helper,"dont you get all gay on me, crimson."
helper,you know i hate it when you worms get like that
crimson,but i like being gay
helper,ughh dont say that gross shit around me!
crimson,too bad. one of my favorite hobbies just happens to be pissing off my bossy triangle wife
helper,well you're certainly very good at it lately.
crimson,"im sorry, love"
helper,it used to be so cute. watching you chase after anyone who reminded you of me.
helper,however. you're loosing your touch. these choices are starting to get downright insulting.
helper,"its getting old, sweetie."
helper,you'll never be able to replace me so why are you even trying to? you can still talk to me anytime.
crimson,im not! i wouldnt ever
crimson,its just so hard
crimson,it doesnt matter where i go or what i do
crimson,i see you in everything. everyone
crimson,id give anything just to hear your voice say my name again
helper,ew.
helper,you're so desperate. i think its even getting worse.
helper,very unattractive.
crimson,"golly. you're sweet to me, pumpkin"
crimson,i wonder why we dont chat as much anymore
helper,i cannot believe you'd just blatantly admit to avoiding me.
crimson,whoops. how did i ever let that one slip?
crimson,gosh here let me try to figure that out hmm
crimson,might take a while because im so fucking stupid 
crimson,and you're the genius with a million secrets 
crimson,who doesnt trust me with any of them!
helper,"oh, im surprised you understand that much!"
crimson,oh no. i dont. 
crimson,"even after all this time we've spent together, all our history"
crimson,i still doubt that i actually know a single thing about you
helper,"my darling red spaghetti, give yourself more credit! tsk."
helper,you know one or two.
helper,its not my fault i have to repeat things constantly. only for you to always forget them!
helper,"how are we ever going to make progress with you like that, hmm?"
helper,you cant keep up with me. who do you think is to blame for that?
crimson,"you're more problem here than i am, celadon."
crimson,you know absolutely everything about me and my whole life
crimson,you can hear all my fucking thoughts
crimson,feel all of my emotions
crimson,yet you still just say and do things that will really upset me!
crimson,if you can predict everything i fucking say
crimson,you could just fix our issues
crimson,but you dont
crimson,you refuse to change your methods at all.
crimson,you treat me like a little pet worm!
crimson,not someone you care so much about
helper,and i take such good care of my little pet! in the way you like best!
helper,as i've said countless times before - i'll change as soon as you do.
helper,"im only behaving how you want me to, dum dum."
helper,"if you dont really like it this way, pick something else!"
crimson,you fucking shitty evil triangle alien motherfucker
crimson,i hate you!
helper,ahahaha! i dont even need to read your thoughts to know that's bullshit!
helper,"there there, my masochistic baby pop - you'll get there somedayy."
helper,just kidding. you'll always love me!
helper,"i know worms of all kinds have a strong, innate sense of loyalty to those they've given it to."
helper,"by nature, you're a very emotionally driven creature. however - you take compassion and dedication to the most extreme levels!"
helper,"there's no end to your love, or what you would sacrafice to help others.. even creatures that aren't like you!"
helper,you fight for whats best for everyone! everything - even what you dont understand! even your enemies!
helper,such a shame you cant actually seem to accomplish anything you want! or have anyone notice your incredible efforts and perseverance! ahahaha!
helper,you're just an altruistic with a martyr complex who just wants to be understooood~ and get some validation!
helper,"not that you actually need those things, silly!"
helper,what you do need is some serious help!
helper,"pssst, that's~ why~ im~ here, you're welcome!"
crimson,fuck yoou
crimson,i dont need or want your help!
crimson,all you do again and again is emotionally abuse me 
crimson,"because you claim you ""dont understand"" pain and emotions "
crimson,and then always expect me to forgive you and teach you about them because im the only one you trust to understand you!
crimson,but you arent improving you're only getting worse! and scarier! 
crimson,then you tell me its my responsibility
crimson,well guess what! its not! its yours! 
crimson,i dont deserve to be treated like this anymore! 
crimson,its not fair or good for either of us!
crimson,i dont care how special or smart or alone you are
crimson,i want out of this fucking endless nightmare!
crimson,im not equipped to handle this! 
crimson,i dont care if you're always the one right about things!
crimson,the way you treat me will always be wrong!
crimson,"i really thought i could help you, celadon! "
crimson,but it turns out that i cant! i failed! 
crimson,and you failed to give a single fucking shit about me!
crimson,im sorry i was so damn naive to think you could care! 
crimson,what a mistake that was! wow!
crimson,so go find your fucking flying saucer and go bother someone else before this shit gets any worse!
crimson,do you hear me?! its absolutely over! 
crimson,now leave! me! the fuck! alone!
helper,"but, you said you loved me!"
crimson,yeah. well. 
crimson,its incredible to me that you still dont get that i do. 
crimson,that i only wished what's best for you.
crimson,you're just a lost alien 
crimson,i thought i could take care of you and make you happy
crimson,but i projected too much empathy
crimson,clung to too much hope.
crimson,i cant love something that wont love me back.
crimson,we just dont understand each other. im not the one who is best for you.
crimson,this isnt healthy for anyone
crimson,its not going to work out like this.
crimson,i refuse to allow this sort of messed up relationship to continue.
crimson,i gotta love me more than i love you
crimson,"maybe then you'll understand or.. i dont know, i give up."
crimson,but i do know you'll be absolutely fine without me. you dont need me to survive.
crimson,"good luck. and goodbye, celadon. i hope you'll find what you're looking for."
helper,"ooh honey.. you're always so close to doing things correctly, arent you?"
crimson,"there is no ""correct."" there's only just options you choose. "
crimson,that one happened to be mine.
crimson,i dont regret what i said or meant then!
crimson,im sick of being dragged through memory lesson-fucking lane!
crimson,"let me go back to dylan! release me, celadon!"
crimson,its my body - not yours! 
crimson,youre not even fucking real!
helper,oho~!
helper,is-is that- could it be?! a glimmer of that old fire in you? is it really true?
helper,i knew you liked that worm!
helper,finally - some actual motivation for you to improve!
helper,im helping!
crimson,no! no you're not! 
crimson,you dont get any credit for this! im the one helping myself here!
crimson,no! no! stop it!
crimson,you dont get to touch or kiss me anymore! 
crimson,do you understand?!
helper,oh darling! you're doing so well!
helper,"you're really standing up for yourself! and to me, even! keep going, keep going!"
crimson,no!
crimson,you're just some fucked up hallucination of guilt or something!
crimson,maybe an extraterrestrial disease?
crimson,"whatever it fucking is, i dont give a shit!"
crimson,"whatever you ""really"" are"
crimson,it doesn't change that you're fucking dead celadon!
crimson,i regret ever meeting you
crimson,all i want is some peace so i can actually try to heal from all the damage you've done to me!
crimson,and how dare
crimson,how dare you take dylan's fate hostage just to force me to confront you more!
crimson,i dont need fixing! its you! you dont doubt or regret any of your actions!
crimson,you will never have the right to do this to me! its torture!
crimson,"i need space, especially inside my own goddamn fucking mind!"
crimson,i need to get back to dylan!
crimson,you cant keep me from her caged like this
crimson,i wont let you!
helper,huh?
helper,ohh! where are you running off to now?
crimson,dylan!
crimson,what?
crimson,hey!
crimson,shit!
crimson,hang on! i got you!
crimson,um
helper,yeeeeeeeeeeek!
helper,oh! you caught me! thank you kind dmtian citizen!
crimson,uh huh
helper,oh! excuse me! you have a leaf on your cranium! i shall assist you with its removal!
helper,there you go!
crimson,thanks? 
crimson,um then
crimson,are you okay?
helper,"well! since you have mentioned it i have developed quite the appetite! good thing i have acquired this organic ""sal-lad"""
crimson,so that's a no
helper,mmm! delicious! ha ha!
crimson,im setting you down now.
helper,understood!
crimson,so are you out here alone? or
helper,what? no! you are also presently here!
crimson,"thanks, smartass"
crimson,"wait, that symbol on their weird looking uniform"
crimson,its the tricend airforce!
crimson,you're a pilot
helper,i suppose that statement is accurate!
crimson,interesting
crimson,where's your ship?
helper,right here of course!
crimson,is something wrong?
helper,i am quite fine! thank you for inquiring!
crimson,i knew tricends are supposed to behave really oddly but
crimson,i dont even think ive seen animals eat grass so enthusiastically
galore,humannn
galore,fuck me human
galore,i crave your sseed insideee mee
crimson,just give me like 10 seconds here
galore,pleassee humannn
galore,i can be anything you desiree just first give your delicious seeed to meeee
helper,hello! are you speaking to me?
galore,i am not
helper,oh! excuse me! do you have any delicious seeds? i believe they are needed!
crimson,i'll never get the full ten seconds
helper,ah! here he comes!
galore,oh he'll be coming alright
helper,yes! he is already in the process of doing so!
helper,well! i hope you will be able to locate the suitable amount of nurishment you require!
helper,if you would excuse me i must resume with my own meal!
helper,"oh, hello again! have you brought the seeds?"
crimson,where's your ship
helper,"huh? but - if i am not mistaken, i already told you!"
crimson,specifically.
helper,"oh, in that case, it is ""located"" in my mind! is that more clear?"
helper,"in other words, it is conjured by my thoughts!"
crimson,"so this ""ship"" of yours isnt actually made of metal"
helper,may i please continue my meal?
crimson,are you even part of tricend?
helper,what is tricend?
galore,whats the hold up?! 
galore,let's get to fucking!
helper,"oh! i apologize! am i, perhaps, interrupting a courting ritual?"
helper,"ah! i see now! the ""delicious seed!"" could that be a metaphor? how creative!"
helper,so this is your potential mating partner? please don't let me intrude!
crimson,no
crimson,it is not.
helper,it isn't? 
crimson,no. never.
helper,"oh, my mistake!"
crimson,im sure you're probably a very lovely walking crotch for your species but im not interested. thanks.
galore,uh
crimson,have a nice day bye
galore,uh
helper,"i wish you luck on your goals of fornication and proper ""seed"" collecting!"
galore,"you cant reject me, human! that only makes me want you mooorre!"
galore,it hurts
helper,why does it hurt? are you injured?
galore,i just shat out my own guts
helper,why'd you do that?
galore,i dont know
galore,being rejected just hurts so much
galore,so much inside that this 
galore,just feels so right to do
galore,so i did!
galore,but ohhh
galore,this also hurts
galore,i feel like im going to 
galore,i cant contain it!
helper,"contain what exactly? your organs, perhaps?"
galore,"no! well, yes that too"
galore,but it feels more like the agony in my heart is about to burst!
galore,the pain of being turned away by that human after all that time we spent together
galore,how could he do this to me? 
galore,i dont understand!
galore,i told him i'd give into all he desired! so why?
galore,what am i supposed to do now? i was sure that offer would work
galore,should i go and try to find someone else? what if they do the same!
galore,im suddenly plagued with this horrible doubt
helper,you are? wow! i did not realize the immediate physical dangers of doubt! it sounds rather painful!
helper,"would you like some help with that? perhaps you would be better suited without doubt, for example!"
galore,huh? what do you mean
galore,could you actually do that? is that true?
helper,yes!
crimson,hey-
galore,humann
galore,does this form please you?
helper,retractable teeth?
helper,gulp. hello!
crimson,would you get up and stop eating grass?!
helper,oh! but! i am still hungry!
crimson,"well then i'll get you something better to eat than grass, okay?"
helper,better than grass?
helper,where are you dragging me to?
crimson,"just be quiet and follow me, would you"
galore,im warning you
galore,"if you take too long, i promise i will hunt you down and carve out your little eyes"
galore,so dont keep me waiting
galore,me and my several hot wet pussies that is
helper,i count five!
crimson,i think i got some in my mouth!
helper,is that bad?
crimson,im not going to answer that
crimson,hey
crimson,"you're hungry, right? so come on"
crimson,"pick up the pace, will you? we dont have much time to spare here"
helper,we dont?
crimson,you dont seem to be very aware of the situation going on are you
helper,the pussy situation?
crimson,yeah. that one.
helper,what is it i am not noticing?
crimson,why were you up so high in that tree?
helper,i was meant to be there!
crimson,"define ""meant."""
helper,"meant! verb, a simple past tense and past participle of mean!"
crimson,are you trying to be annoying? or what
helper,should i be?
crimson,look just
crimson,help me out here with understanding
crimson,cause i dont get it ok?
crimson,"why are you out here in the middle of nowhere, and more importantly"
crimson,how did you get here?
helper,i am here because that is what i was supposed to do! i did not have a choice.
crimson,no choice?
crimson,are you following an order or something?
helper,"i am not currently, no."
crimson,but you do recieve orders?
helper,not anymore.
crimson,and why is that?
helper,it is because i am broken! 
crimson,you're what
helper,a failure!
crimson,huh alright well
crimson,um
crimson,my name is crimson
crimson,what's yours?
helper,"asshole! pleased to meet you, crimson!"
crimson,are you saying your name is asshole?
helper,well that is what they keep calling me.
crimson,who?
helper,them.
crimson,are you pointing at something?
helper,"my pointing is purely metaphorical. it would be impossible for me to actually direct your vision to them, crimson."
helper,but they are everywhere.
crimson,they are?
helper,"yes, my ""haters""!"
helper,you see - i have been informed of their constant surveillance of my thoughts and actions. but. their judgement holds no true power over me.
helper,i will not let their presence influence the course of my goals! even if they root for my demise i will not falter!
crimson,let's go get you something to eat.
helper,"that sounds acceptable, crimson!"
helper,hello!
crimson,here.
helper,"what is this, crimson?"
crimson,it is a blanket. because you are smelly
helper,i am?
crimson,yes. i also dont want that slime on my truck seats
crimson,need help getting in?
helper,"i am quite capable of a variety of complex physical maneuvers, thank you!"
crimson,"go ahead and sit in the back there, alright?"
helper,"understood, crimson!"
crimson,and remember to not get that goop on anything.
helper,"i will be mindful of the vaginal discharge! don't worry, crimson!"
crimson,"good. this is for you too. something to snack on. a ""thing-a-ling."" enjoy."
helper,thank you!
crimson,"uh, wait hold on"
crimson,you gotta take the plastic wrapper off first. dont eat that part.
crimson,there. now try it.
helper,"crimson! this ""thing-a-ling"" is quite drastically better than grass! thank you!"
crimson,no problem asshole?
helper,crimson? do you by any chance have more thing-a-lings in your posession?
crimson,yeah.
helper,then may i please have another?
crimson,yeah.
helper,"thank you, crimson!"
crimson,mm
helper,"excuse me, crimson? could you please open this again?"
helper,"gasp! thank you, crimson!"
helper,"crimson? i was curious! do you perhaps have a third thing-a - oh! wow! thank you, crimson!"
crimson,hey. listen up.
helper,hm?
crimson,im going to need you to promise me something
helper,a promise?
crimson,that's right.
helper,"what is it, crimson?"
crimson,wait for me and stay inside the truck until i get back.
helper,stay here until you return?
crimson,"mhm. you can go ahead and take this too. that way, if you run into any issues or danger"
crimson,just press and holw the red button here. and talk into the phone. i'll be able to hear you.
crimson,understood?
helper,"i believe so, crimson!"
crimson,good. i'll see you in a little bit.
crimson,"oh also - keep your head down from the windows, got it?"
helper,"i have ""got it,"" yes!"
helper,crimson? when you return may i have another thing-a-ling?
crimson,yes.
crimson,get your head down lower.
crimson,lower.
crimson,head down!
helper,crimson? are you back yet?
crimson,i havent even left yet.
helper,oh! i see.
crimson,is that all you wanted to ask me?
helper,am i allowed to ask you more questions?!
crimson,i suppose.
helper,"then who named you ""crimson?"""
crimson,i did.
helper,oh. then what is your real name?
crimson,that is my real name. and you will respect it.
helper,is that a command?
crimson,that's right. respect me. got it?
helper,understood. i will respect your command crimson.
helper,crimson? if you were able to name yourself
helper,"does that mean we are allowed to do so, if we wish to?"
crimson,you can.
helper,"i see, then what is the reason for choosing ""crimson"" as your name?"
crimson,that's personal.
helper,"so - it is based on factors which are important to you, using your own values of merit?"
crimson,you could say that.
helper,i have said that. now i am requesting confirmation on my observation. is my assumption incorrect?
crimson,it-its a figure of speech. alright? im saying you're more or less correct about it.
helper,which one is it? more or less?
crimson,why are you - asking me so much about my name?!
helper,"i am attempting to expand my current knowledge on the topic of ""names."" if i am to respect them properly - i wish to understand their functions more accurately! especially if names are considered to be ""important."" "
helper,"are my questions causing you distress, crimson?"
crimson,no. they're not
crimson,its just very unexpected?
crimson,and im not used to articulating these things at all
crimson,im not sure if im the best to ask but i'll give it a shot if you're honestly confused
crimson,just keep in mind its not really something you can learn everything about
helper,why is that?
crimson,cause names can mean different things
crimson,its up to the individual
crimson,if we're really going to be talking about this i need to understand where you're coming from better
crimson,so i gotta ask.
crimson,is the name you told me
crimson,is that your only one?
helper,are we meant to have more?
crimson,not necessarily?
helper,"do you have multiple names, crimson?"
crimson,"no! hey, im the one asking about you here! "
crimson,so hold up!
crimson,how long have you had the name asshole?
helper,"thirty three hours, fourty one minutes and seven seconds!"
crimson,and that's the first name you've had
helper,there has not been a prior time where the use of one would have been required!
helper,however - im willing to adjust myself accordingly as i am now in a new cultural environment! besides that - i would like to take the oppertunity of an individual such as yourself - who has given me the patience to explain such things to me!
