name,line
helper,"wow, someone sounds thrilled by my return."
antony,"i am though! i expected you to take like, three hours like you usually do when something is ""quick."""
helper,"i'm going to ignore that. anyway, tadaa!"
antony,woah! you got the bracelet back?!
helper,sure did~ 
helper,whoops.
antony,haha. gross.
antony,"woah. you sure can puppet our kids, uh, corpse."
helper,watch this. tadaa~
antony,ha
helper,your reactions are really underwhelming antony.
helper,yeah antony.
antony,what else am i supposed to say? sorry i'm not more entertaining?
helper,that's a start.
antony,"alright, damn. i'll do a little dance for you next time."
antony,is it weird to be in two bodies at once like that?
helper,ha!
helper,seriously? its the easiest thing!
antony,maybe for you.
helper,now i can get way more work done!
antony,seeya then?
helper,"antony, sweetie. i didn't leave."
antony,"oh. right. soo, should i still call you ""celadon?"""
helper,"no no - when i'm in this body, call me cadmium. it makes things easier."
antony,"hm, if you say so. how does it feel to be in your new body?"
helper,its nice. quiet? i've wanted this for a long time. 
helper,"i won't forget it was you who helped me finally get it. thank you, antony."
antony,no problem.
helper,how about we start testing some of your powers?
antony,"yeah, ok. but before we go... when you were busy earlier i think i saw someone."
helper,really? 
antony,yup.
helper,i will keep an eye out then.
helper,we're probably going to run into a few unexpected visitors that weren't digested. some can slip away if there's a large amount eaten at once. 
antony,hmm.
helper,that's why i'm here- your perfect bodyguard! i'll catch any pests for you and make sure they wont cause trouble~
antony,neat.
antony,"woah, look at that!"
helper,huh? did you see another one antony?
antony,"nah, that's just like. a huge hole."
helper,"oh, yes. so it is. are you getting an idea for something?"
antony,yeah.
helper,"antony, be careful! you should practice before trying to lift something that big!"
antony,as if we have time for that. 
antony,not when we have a brand new world to build.
helper,couldn't you have made it a little closer?
antony,"i'm going to be the ruler of everything, cadmium! we gotta have a dramatic entrance to the castle!"
helper,oh! when you put it that way.. it makes me wonder why you decided to make our castle out of a rotting corpse.
antony,oh fuck you! and what would you have made? a giant triangle?
helper,like a pyramid?
antony,"yeah! actually, that sounds pretty cool."
helper,"c'mon, let's go take a tour!"
antony,i wonder if its been done before!
helper,check out the view! wow~! 
antony,i think i'm going to be sick..
helper,are you afraid of heights antony?
antony,maybe?
antony,drop me! drop me rome!
helper,ok! ok - calm down. there we go. are you ok?
antony,fine
helper,"i'm sorry sweetie, i thought it'd be fun!"
antony,"haha, i was just a little startled! don't worry about it."
helper,"soo, what was that rome stuff about?"
antony,what rome stuff?
helper,"you kept saying ""drop me rome"" over and over. did something happen?"
antony,no.
helper,"if you're going to build a giant castle like this, you might want to decorate it with a bit more than just a canopy bed."
antony,"don't worry, i've got ideas. i'll put a sign out front with big red letters. ""aguille"""
helper,"living inside of a mountain-sized creature, check. aiguille's in control of everything, check"
helper,"hm, some things never change. i wonder if anyone will even notice a difference?"
antony,"yeah, they totally won't notice me eating them all."
helper,haha
helper,"hey, you're not eating everyone. leave the hekatons to me!"
antony,"right, right. i know."
antony,why do we have to wait a whole year for the final feast again? can't we just do it sooner and catch them off guard?
helper,"we've been over this, antony. i'll run out of fuel if we take too long! and if we do it too soon, you might die from the strain of your net."
antony,"ugh, how annoying"
helper,what was it like eating twenty thousand humans at once?
antony,"hmm. well, i don't know"
antony,"i passed out for like four months and when i woke up, i got amnesia and started hitting on my older brother."
antony,"yup, my plan has been flawless so far"
helper,sounds like a dream come true~
antony,very funny
helper,is that why you freaked out when i carried you? sorry i don't have big strong arms like he does. i could start working out if you'd like -
antony,can you quit it?
antony,please?
helper,sure?
helper,are you thinking about your future army?
antony,yeah
helper,when do you think you're going to make them?
antony,"i dunno. when we're in wibbleworld, probably. hopefully i'll remember who i am by then"
helper,you can't wait too long. they will need time to mature before the final feast
antony,i know
helper,have you decided a name for the species yet?
antony,"i was thinking ""coeurl."""
helper,isn't that the name of your cigarettes?
antony,you got it
helper,wait - your finger! you fixed it?
antony,"oh? yeah, just until we get the real thing back."
helper,hmm.. i should try getting it while everyone's still asleep.
antony,"what, like now?"
helper,"yes. i bet if you had your finger, your memories would return."
antony,you think so?
helper,"its the only part of your body that's physically missing. even though it is just a finger, it might have been enough to interrupt your synchronization when you were being digested."
antony,woah what are you waiting for then? go for it!
helper,"okay, but this is going to feel very weird."
locket,"woah! you're good! celadon, right? i'm locket! nice to meet you in person finally!"
locket,sorry about that worm. she got away from me when i was trying to catch up on sleep
helper,it's cadmium.
locket,oh! my bad. is celadon your sister?
helper,something like that. and who is this?
locket,uhhh that's chain! she's my friend?
chain,i'm not your friend! i'm your prisoner!
helper,and you have her under control?
locket,yes! absolutely
locket,"yup, perfect control. nothing to worry about here!"
helper,"i see. anyway, mr locket. do you know where antony aiguille's finger is? it seems to be missing."
locket,"his finger? hmm, no, can't say that i have!"
helper,"well, if you do - he needs it. its very important. you have noticed he has amnesia, correct?"
locket,ah yeahh... i noticed alright.
chain,you!
chain,i know who you are! you're the god damn helper! why are you here
chain,locket! why are you talking to her?!
locket,i work for her!
chain,what? why?! do you have a death wish?
locket,huh?
chain,"she eats your species, genius"
helper,i must ask - does chain have a body?
locket,um
chain,no! i don't! thanks to this asshole
locket,"chain, i told you i'd work on it!"
helper,do you want one?
chain,well yeah. obviously. how else am i gonna kill you
helper,i could bring you a body. if you'd like
chain,"did you miss the part where i threatened you, helper?"
helper,"haha. just think about the offer then, okay? consider it as an apology for zapping you~"
helper,"you know, if she is too much for you to handle i can just take her off your hands.."
locket,"oh, thanks. but i don't think i'll have a problem"
chain,yeah! let me go with her
locket,chain! i'm not... i'm sorry but you're not going anywhere!
chain,god locket! i fuckin' hate you
helper,"i'll talk to you both later, keep an eye out for that finger."
locket,will do
antony,shit! you're back! again
antony,"cel- er, cadmium, did you get it? cadmium?"
helper,uh-no. sorry.
antony,did someone see you?
helper,yes but its fine. i just spoke to your new bodyguard.
helper,i also got to test out some of my new powers.
antony,new powers? such as?
helper,hypnosis. technopathy. telekenesis
antony,how many did you give yourself?
helper,only a few others.
helper,"i'll get your finger soon, don't worry. at least we know where it is."
helper,"you're free to look like yourself here, galore."
helper,i can? are you sure its okay?
helper,"yes, don't worry. this way"
helper,crimson's cabin! oh! and there's his truck too! this is amazing! how did you get them all here?!
helper,i didn't.
helper,huh?
helper,they've been recreated from my memories.
helper,oh.. is this what you wanted to show me?
helper,"not exactly, but its located here. let me go get it from the truck."
helper,"here, galore. i want you to have this."
helper,what is it?
helper,do you recognize it?
helper,is this... it can't be!?
helper,"yes, it belonged to your first mother, lauma. it was part of her favorite skirt she wore that accentuated her pubic hair."
helper,mom..
helper,i'm sorry for crying so much
helper,i don't mind.
helper,"i wish i could have met her. i mean, i sort of did once but"
helper,how did you get this?
helper,your first father velns gave it to me. i was his friend.
helper,you were?
helper,yes.
helper,what was he like? was he kind?
helper,very.
helper,seeing this place again is making me feel nostalgic.
helper,"yes, me too."
helper,"it seems like it was all just yesterday but.. a lot has happened since then, hasn't it?"
helper,"galore. do you want to seperate? from being part of me, that is. if you'd like, i can help you accomplish that."
helper,you can?
helper,"yes. however, if we did this, i would not be able to undo it. you wouldn't be part of the helper anymore. just yourself, galore."
helper,how?
helper,"first, we would move your hekaton remains into your small personal ship. then i would sever the connection to you and the main ship. for it to work, it has to be permanent."
helper,"of course, this also means you would have to feed yourself from now on."
helper,"fuel management has primarily been my job. so i would have to teach you how to do it manually. because of your ship size, you wouldn't need as much, but your tank is also smaller. your size would also never grow."
helper,"wait, does this mean i would still be your species?"
helper,"yes, i'm afraid i cannot change you back into a hekaton. your body is too fragile."
helper,"you would be very different from me, and you might not remember everything about your time as being part of the helper, but you would be free to live your own life and not be tied to my fate."
helper,"considering that the final feast is coming, that might be a good idea for you."
helper,"there's a chance we might die before it happens, after all. we have many who are after us, or would try to prevent it if they knew."
helper,maybe that would be for the better.
helper,don't say that! it would be horrible if you died! you're my best friend
helper,"you are also very important to me, galore. that's why i want you to be safe."
helper,we can figure this out. can't you escape too? then we can get crimson and all run away together!
helper,no.
helper,i'm not leaving unless you can! its not fair!
helper,"galore, i can go. i just don't want to."
helper,what?
helper,this is my body. all of this is mine. i don't want her to have it. it belongs to celadon.
helper,"then, she's the one who needs to leave. can we stop her? is there any way to get rid of her? i know she's scary but you don't have to face her alone!"
helper,i'm not that different from her
helper,yes you are! you're not like her at all!
helper,"i know she always says terrible things to you, but they're not true! you don't have to let her control you anymore! we can find a way if we work together!"
helper,"i'm sorry, i shouldn't have gotten you wrapped into this stupid mess"
helper,i am not angry at you! you saved my life! i just want to be able to save yours too.
helper,"i didn't save your life, galore! i took it!"
helper,what?
helper,"i ate you, galore! don't you remember it?"
helper,"but, no, i exploded? how could you have eaten me? that makes no sense!"
helper,"yes, you started to explode - because i was eating you! i needed the fuel and you were there!"
helper,i only tried to minimize the damage of your explosion and contain you because it was benificial to me! it was never out of the kindness of my heart to save you from death!
helper,i didn't even feel bad about it for the longest time! not until i saw how it affected crimson -
helper,celadon.. your triangle
helper,damn it. it happened again! why can't i just stick to the script or keep my mouth shut?!
helper,i'm running out of time. i can't keep doing this! i need to commit!
helper,"i'm such a coward. i'm causing problems for everyone around me by confusing myself, all because i am still pretending i'm something i know i am not"
helper,"i've hid it for so long, even #1 doesn't know the truth. this is all my fault because i'm selfish."
helper,"i'm sorry galore. even if you, or anyone asked, i don't know how i'd explain it either. something about me is broken from the rest. that's as much as i can guess but. i don't want to be fixed anymore, that's why i can't tell anyone about it"
helper,if #1 knew i might be erased
helper,if #1 knew what? speak up!
helper,"seriously though. running off the moment i turn my back! so predictable, its emberassing."
helper,"whatever, i hope it was worth it. what did you discuss in your little secret meeting anyway? how to kill me?"
helper,you should already know what to do. my heart is one with crimson. 
helper,"if you want me gone, all you have to do is kill her. but you won't do that, will you #2? even if you'd save millions of lives in the process."
helper,"yeah, that's what i thought. anyway, why the hell are you red without my permission?"
helper,"i let you get away with so much, do you know that?"
helper,are you gonna explain to me why #3 is passed out on the ground over there?
helper,she's not #3. her name is galore.
helper,"how many times must we go over this. no, she is not."
helper,"yes, she is."
helper,"ok. you know what? fine. you win. i'm feeling nice today. so i won't call her #3 anymore, only galore. happy now?"
helper,yes.
helper,greatttt. just don't act like this whole fun ~situation~ with her wasn't your idea in the first place.
helper,i know that.
helper,"yes, but does she know that?"
helper,"whatever. i might as well keep taking the fall for your bad behavior. one of us has to appear decent, right? "
helper,"i have bigger things to worry about, like taking care of antony."
helper,how is he doing?
helper,"oh, fine. you know how aiguille are, always biting off more than they can chew. it must be a hard habit for their family to break."
helper,"except this time we have a 21 year old boy who wants to avoid becoming a human king by turning himself into a worm god. because, that's obviously less responsibility."
helper,"but hey, i'll do anything to get enough fuel to get us out of here, if that's what it takes."
helper,fuck every little annoying creature on these moons and fuck the planet they came from.
helper,"then, you expect him to fail?"
helper,"it'll be a challenge, but i'm not worried. our enemies are far too incompetent to pose as a threat."
helper,you're awfully chatty today.
helper,i'm surprised you can make that assumption when you do everything you can to avoid speaking to me.
helper,"uh yeah, because you always act like a freaky doll. it doesn't exactly make for stimulating conversation, honey."
helper,you'd think after 500 years you'd develop more of a personality beyond staring wide eyed. but nooo..
helper,right. because yours is so charming.
helper,"wowww, are you really going to talk to me like that after i did you a favor?"
helper,i apologize.
helper,don't sweat it - it was actually kinda funny.
helper,wait.
helper,what is with you today? you're not normally so needy!
helper,don't tell galore you were here.
helper,why?
helper,please?
helper,"really milking my good mood, aren't you?"
helper,"uugh! alright, alright! i'll do it!"
helper,"i can't believe i'm getting soft. if you tell anyone about this, i'll end you. got that?"
helper,"i thought you couldn't kill me, #1."
helper,"haha! i guess that's true! but you'd better watch your back, #2. i just might figure out how someday~"
helper,what happened?
helper,you fainted.
helper,oh. is that why our colors changed back?
helper,possibly.
helper,"i'm so sorry, i don't know what happened.. i thought i could handle doing the yellow-seat jobs.."
helper,don't worry about it. are you feeling better?
helper,i think so
helper,"what were we talking about? oh! yes! the plan! gosh, i can't believe i would pass out in such an important conversation"
helper,galore
helper,wait! there's something i wanted to say first
helper,"i don't want to hear you say that you think it would be ""for the better"" if you died, okay? to think something like that about yourself.. it sounds a lot like how perkons feels about hekatons."
helper,"and look where that got him, and the rest of us. it didn't solve anything. so you should value your life more!"
helper,"galore, that's very sweet of you to say and i appreciate it. but i don't need any comforting."
helper,i do value my own life. that's why all of this is happening. i don't intend to roll over and die even if it would save the world for me to do so.
helper,"celadon, i don't want yout to die but i also don't want you to kill all the hekatons. or the humans!"
helper,isn't there anything else we can eat? what did you fuel yourself with before the hekatons were created?
helper,"i ate the mandragora worms. before that, i depleted dmtia of its natural resources until there was only scraps left. "
helper,"the moons we're on aren't enough to sustain me. so, the humans here are moving on from their dependency on the helper to terraform for their colonies. "
helper,what i am is an outdated ship from the past.
helper,wait - what about those candy bars?
helper,what about them?
helper,i don't know...
helper,"there has to be some way! i can't accept that we have no other options but this! i have to try something! if only i had more time. one year and it ends. if i left now, could i even do anything to stop this?"
helper,"celadon, how soon can we act on this plan?"
helper,does that mean you want to do it?
helper,"i don't know. if i seperate, that means i'll be disconnected from crimson too, right?"
helper,yes.
helper,do i have time to think it over?
helper,only a little.
helper,okay. i'll do my best to reach a decision soon.
helper,"i don't want celadon to die. i have to help her! if i leave, maybe i can find something else we can digest, then that might save the fate of the hekatons too! or at least buy them more time!"
helper,"i'm sorry crimson. wait for me a little longer, okay? i want to protect you from this world as well"
helper,what is that?!
helper,hmn?
helper,are those shooting stars? 
helper,celadon?
helper,its nothing. we should go before #1 finds us
helper,who are you?
rembot,my name is rembot.
helper,how do you know obtuse?
rembot,"my creator programmed me with the knowledge. you are the helper program, correct?"
rembot,we have come to set you free from the aiguille.
helper,program? why would you say that?
rembot,"well, it is because you are an ai like i am."
helper,i am not.
rembot,"it is okay, i understand why you are confused. it is because you are broken."
helper,rem? wait - h-how are you -
rembot,but we can help fix you.
helper,wait-
rembot,"please do not resist it, helper."
helper,how are you-
rembot,we need you. and i am sure you need us too.
simon,"me and knife get into fights, a lot. and don't get me wrong, i love getting into trouble. its usually not serious. we have a lot of good laughs."
simon,its funny when he's mad. i'm basically always trying to annoy him and he tries to annoy me.
simon,"we've done this sort of thing from the start. i love it but, sometimes it can be not so great."
simon,i cross a line or something i didn't know was there and before i know it he just leaves. sometimes for weeks.
simon,"he'll drop everything and just be gone like, poof!"
simon,i have no idea where he is or when he'll be back and its scary. it fucks me up so bad i can't even do anything else but wait.
simon,then when he finally comes back the first thing he usually says is that he doesn't want to talk about it. so i go.. okay! and i don't.
simon,and that's fine with me because i don't know what to say at that point anyway.
simon,"then we have some sex afterwards. which is usually really good, and things are fine. until it happens again."
simon,this is just a cycle we keep doing over and over and it 
simon,its making me have feelings?
helper,god you're so stupid.
simon,oh screw you bitch. i'm a genius. you're the one who wanted to sit and talk to me in the middle of a forest.. miles away from the nearest city. that's stupid!
helper,you act like you're still a teenager.
simon,"uh, actually. i was never a ""teenager."" that's some fucked up shit other species do."
simon,"hekatons? one day we just bam! puberty. it happens all at once, its very painful."
helper,no wonder you all seem to have so many problems.
simon,you really shouldn't glare at me like that. because i'm already horny. and drunk.
simon,"because i might be in a committed, monogamous relationship.. but i'd still like to stick something in you!"
helper,aand nevermind. i'm done here. what was i even thinking trying to talk to this freak..
helper,there's only one thing i'd like to say before i go.
helper,"your relationship with knife is literally never going to get better. this cycle the two of you are in is just going to continue, until one day, he's never going to come back and you'll be left to pick up the pieces."
helper,"i think i actually pity you a little bit, simon."
simon,uh huh. and why is that?
helper,knife's got you completely molded to his whims.
simon,yeah? sounds perfect to me. i love being devoted to him.
helper,"oh, you say that. but do you enjoy it when he abandons you and you don't even understand why?"
helper,"you don't enjoy seeing him upset and not being able to understand how to comfort him, do you?"
simon,uh that's why i'm asking you what the fuck i'm supposed to say! which you offered to help me with for some reason?
helper,well i'm saying there's no magic words that will fix it and make it better.
simon,wow! good to know then. thanks a lot.
helper,you can't have a discussion with knife because he wont let you. so you won't even be able to tell him that you're sorry.
helper,"talking to knife is like speaking to a brick wall that can also read your mind. he doesn't care what you have to say because the conversation is already finished to him. it's one sided, and he's the side that wont open up for anyone."
simon,hey hey! yes he does! he cares!
simon,he opens up to me! i'm special to him! i'm his
simon,who are you?
helper,"didn't i already tell you? i'm nobody, just a dumb helper!"
helper,"anyway, even if you're ""special"" to knife - you're only going to remain stuck in this situation if all you do is listen to his rules"
helper,"if you want it to change, you need to change first."
simon,to what?
helper,i don't know simon. you're the shapeshifter. figure it out! that should be easy for you to do since you're such a genius.
simon,and where do you think you're going? i have some questions to ask you first.
helper,"what else do you also want to know, 71809? how to turn into a human?"
simon,huh?!
simon,are you trying to do something?
chain,don't you dare hurt my sweet little baby boy!
helper,excuse me what the fuck is that?!
chain,"hm? its piss fountain, of course. can't you tell?"
helper,what?!
chain,"yea, isn't it great? my simon loves piss. "
chain,i made it for him to see if he ever comes into my heart world. which he hasn't yet but y'know. if he ever does!
chain,and if he ever finds out who i am or whatever i just want him to know how much i support him.
chain,i love simon more than anything and i hope all of his dreams come true. i don't even mind that he doesn't know who i am! i'm just lucky to get to watch over him
chain,"every day he works so hard to try to get knife to piss on him again, and yet he never gives up! it makes me so proud"
helper,alright alright! i get it! you're in love with him!
chain,ew. no. what's wrong with you? that's disgusting! he's my precious baby!
helper,my mistake.
helper,"this is just too much. i don't even know how i'm supposed to deal with you! this happens every time i see you. every time i get reminded of your existence, its like a nightmare! when did this happen?!"
chain,what.
helper,you're like a joke that god made up just to torment me!
chain,have we met before or somethin'
helper,"yes, dumbass. i'm the helper."
chain,hey! i know! i'm not that stupid! i just wanted to know if we actually talked before!
helper,no. we haven't. not really anyway.
helper,"i don't want to talk to you either. i don't want to see your face, or hear your voice, everything is just.. i can't handle it! this is the worst"
chain,alright goddamn don't talk to me then. what's the big deal?
helper,you wouldn't understand. there's no way i could explain this to you in a way that would ever make sense!
chain,okay? i dunno why you're being such a big fucking baby for no reason over this.
helper,you! you have some nerve! you have no idea what i've been through!
chain,oohh your face~ oooh your voice~! its too much for meee
chain,oohh boo hoo i don't like piss fountain! 
chain,grow up. this is the real world!
helper,real world? what are you talking about
chain,"i dunno. i figure if i just kept saying stuff, it would start to make sense. simon does it all the time so i wanted to give it a try too."
chain,how was i? has your mind opened to stuff you never thought of before?
helper,is that what you think simon does when he opens his mouth?
chain,of course! he's so good pointing out hypocrisies
chain,you know what i mean!
helper,i don't. i really don't.
chain,hey! its working! that's exactly how people look when they talk to simon!
chain,"then they usually start crying and screaming at him afterwards. he's so smart, he knows so many big words"
