name,line
helper,"others have reacted with hostility towards us, even when we simply requested information. of course, it is not our intension to upset anyone - so we do not wish to repeat that course of action!"
helper,"although, even with changing our behavior to be more ""polite"", the results have still been most unsatisfactory! mostly, we have been quickly dismissed or ignored.. until you, of course!"
crimson,what the hell are they talking about?
crimson,uh huh?
helper,"i hope to learn many things from you, crimson!"
crimson,"how about we discuss more of, um. this later"
crimson,'cause i'm still having an issue following all that you're saying
crimson,im still pretty distracted by this thing i gotta take care of out here
helper,"if you say so, crimson! good luck with your task!"
crimson,thanks
helper,"crimson? would you like any assistance, by any chance?"
crimson,no. just stay in the truck
helper,understood!
helper,"one other thing, crimson - i am not sure if you are aware of it but that creature from before - the one which had several pussies? "
helper,i must warn you - they have what seems to be a very powerful detonation device inside of their chest cavity. if it explodes - the blast radius would likely cover 150 to 250 yards.
helper,"so, perhaps be mindful - if you do come across it again."
crimson,what? are you - talking about some sort of bomb?
helper,"it appears so, but i am not completely certain of what it is exactly. "
helper,"it moved from the left thigh to the center of their upper torso, behind the sternum."
crimson,and how do you know this?
helper,i detected it with my visor!
crimson,and you're saying it could cover a range of 250 yards?!
helper,"yes, well, readings indicate that it fluctuates irregularly. when the creature was in emotional distress the energy levels were greater than when it appeared happy."
helper,when we left it - the hypothetical blast range would only be about 50 to 75 yards. 
helper,it was lowest when it was spraying fluids from its vaginas!
crimson,have you run into these things before by any chance?
helper,"i have not! what about yourself, crimson?"
crimson,"fairly certain, yeah"
crimson,"i had a hunch it was what we were dealing with when i saw her, but"
crimson,i dont even really know what they are besides not being worms
crimson,with so many billions dead in this apocalypse information is hard to come by
crimson,"and in the case of the ""daddy long legs"""
crimson,people rarely even see them
crimson,"and when they do, they just try to stay away"
crimson,"i mostly hear stories about the ""daddys"" crawling around in the wastes"
crimson,even where the fallout is so bad its just sand
crimson,guess im not too surprised one showed up in this neck of the woods
crimson,we're pretty close to a border of a toxic cloud
crimson,"this ""storm"" has been growing worse recently"
crimson,people suspect this whole area will be completely engulfed in a few months
helper,"ah, yes! the storm! i was attempting to travel through it before i crashed."
crimson,let me get this straight
crimson,you were trying to fly your ship through the storm?
helper,"yes! well, i had to"
helper,"according to my calculations, if they are correct, that was where the distress signal was coming from!"
crimson,signal?
helper,yes! my friend is in trouble - i am on my way to find and assist them!
crimson,your friend sent a signal from inside the storm?
helper,yes!
crimson,and that's why you're out here
helper,"yes! well, partly!"
crimson,the other reason is?
helper,i have been discarded!
crimson,care to repeat that for me?
helper,i have been thrown away! like garbage!
crimson,i gotta go! talk to you later
crimson,no
helper,crimson? are you alright? do you need help?
helper,"i must admit, i did overhear your private conversation. and i believe the last thing you said was ""no."" is that correct?"
helper,"perhaps, as a suggestion you take a deep breath. then, calmly but firmly say it again!"
helper,if the hekaton does not comply with your request - i will leave the truck to assist you! how does that sound?
crimson,stay in the truck!
crimson,im not a man!
crimson,i may sound and look like a human man but im not! im not
crimson,god i wish i was a human man but im not! and ill never be!
galore,do you know what you sound like to me? like a coward
galore,"and there is nothing more like a human man than a pathetic, groveling lying coward! so congradulations!"
galore,that sound
galore,are you crying? ha! well suck it up
crimson,im not lying! im telling the truth
galore,then what are you?
crimson,i dont know
helper,i believe you.
crimson,excuse me?
helper,"i do not think you are lying, crimson. if you state that you are not a man - i believe you."
crimson,that conversation was not for you
helper,"yes, i am aware! my apologies. the equipment that you provided me with is partially defective. "
helper,"i really had no alternative but to listen to your discussion! and well, you were shouting quite loudly, crimson!"
antony,oh! you're out already.
antony,well! g'morning sunshine! sleep well?
antony,"guess you were right again. how do you do it, celadon?"
helper,are you really that surprised? please! im always right!
antony,"ah, of course. "
antony,how could i forget?
helper,hi there sweetie. can you stand?
helper,ohh! now why are you growling at me?
antony,uh oh! trouble!
ash,i know you
helper,really?
ash,yes! i killed you!
helper,oh my! you have?
ash,several times
helper,"did you hear that, antony? im dead!"
antony,damn that's wild
antony,didnt know i was speaking to a ghost
helper,"dont be silly, antony. ghosts arent real."
antony,"wait. did he just say ""several""?"
antony,"just how many of you are there, celadon?"
helper,simple! how many sides does a triangle have?
antony,three?
helper,that's right~ three!
helper,see? im very easy to keep track of!
antony,hah sure
ash,what is this?
helper,"it it is a blanket, because you are smelly!"
helper,its not fair i never even got to talk to her once! i never even got to touch his hand
helper,the only moment i had with them was
helper,i knew i shouldnt. that if i went i would probably mess up everything but
helper,those desperate strained cries he was making
helper,it sounded like he was in danger! i had to see and make sure they were safe!
helper,crimson? 
crimson,celadon!
helper,you're up late again
crimson,um yeah
helper,"well since you're up, i was wondering"
crimson,uh huh?
helper,are you hungry for a midnight snack? 
helper,"if you're interested, lie down on the floor. you'll need a pillow. "
helper,now close your eyes. open your mouth. stick out that tongue more. there we go
helper,how do i taste? arent i good?
crimson,delicious
helper,i wasnt really there but.. that moment
helper,"i didnt care how fake it all was, i didnt want it to ever end"
helper,"the dream where you were mine, i was yours, and i was the special girl who could make you happy."
helper,"but when she looked in my eyes, she couldnt tell who i really was!"
ash,ookaay?
helper,"soo what is going on over here, huh?"
helper,i thought i asked you to give him a blanket. how did you manage to get upset this time?
helper,"what happened to me, its going to happen to him too, sort of"
ash,what is?
helper,"what, the period sex?"
helper,not that! you know what i mean
helper,"anyway - why dont you tell me your name, big boy? then i can properly address you when i answer your questions!"
ash,my name? it
ash,ah yes! i remember
ash,"my king named me ""ash!"""
helper,"well, ash~! i must apologize for my blue ""sister"" here. she doesnt know what she's talking about at all. you see"
helper,"a long time ago, she installed herself with a fucked-up almost broken battery she found in the forest and has been a big stupid mess ever since! "
helper,"why, she even thinks she is the battery, isnt that sad? so, seriously - dont worry about whatever weird shit she says, okay?"
helper,i know im not her... i just really wish i was instead of you
ash,unhand me you articifical human meat
helper,"ash sweetie, we're just trying to help you stand up!"
ash,i am not in any need of your puny assistance
ash,do you not know who i am?
helper,"careful, your blanket is slipping"
ash,i am king leadman's knight! he pierced me
helper,oh my!
ash,with his glorious crown!
helper,was it big?
ash,y- wait.. no
helper,hm?
ash,maybe it was i who pierced him? against
helper,what? really?!
ash,i sucked his dick. with my own two hands!
ash,i seem to recall a wall?
helper,"please, tell me everything! and dont spare a single detail!"
ash,then i dueled with the green metal man
ash,"he was more powerful than i expected, i admit. "
ash,but! i took on the challenge fearlessly
ash,"a robot which specialized in an advanced and deadly weapon called the ""memes!"""
ash,he attempted to use them on me! me
helper,you?
ash,me!
helper,"well, did you win?"
ash,no. it was more like a draw i suppose but
ash,as soon as i see that horrible grinning toaster i swear i will do whatever it takes to make a robot.
ash,go away!
helper,oooh~ 
helper,"i wish you luck with that, ash. i heard they can be pretty tricky to destroy."
ash,yes! well! no matter! i will discover the toaster's weakness!
helper,why dont you turn yourself around coward
simon,nah. i actually prefer it from behind
helper,i saw what you did to my bodies simon!
simon,sooo you know my name? i'm sorry but have we met before?
simon,oh hold on a minute. you're that helper from the car garage
simon,what are you doing all the way out here in the woods at night?
simon,judging from your clothes i dont think you are one of my helpers 
simon,do i own you?
helper,no. i belong to someone else.
simon,alright
simon,"then to what do i owe the pleasure of your company, helper?"
helper,"oh trust me, simon. this will not be a pleasant chat either of us will enjoy. you'll see."
helper,"today you bought thirty of us. in other words, me. because i am all of them. and i saw what you did to those helpers. my. bodies."
helper,"you order us from the helperstation. have us made in the 3d meat printers, built exactly how you want us to be. then those helpers"
helper,they will follow your every command. obey your every wish. total loyalty without question. so what did you decide to do with them? hm? in the short 72 hours they have to exist?
helper,you had them ripped apart. by that monster
helper,why didnt you just get some fucking pinatas instead?
simon,lmao
helper,and what is so damn hilarious?
simon,hello? isnt it obvious? c'mon!
simon,death
helper,"ooohh i see. arent you so fucking edgy. careful there, you just might cut yourself in half one of these days."
simon,"hey, who hasnt laughed at something they shouldnt? lighten up and live a little, party pooper"
helper,"excuse me? why would i ever find my own death amusing? thats never funny, you piece of shit"
simon,"well, maybe its not funny to you. but thats just your opinion now isnt it? "
simon,"speaking of opinions, i think you probably have a lame sense of humor"
simon,am i right?
helper,my opinion is that you should be ashamed of yourself and this emberassing try-hard evil shtick. but i dont think you're capable of doing that.
simon,now why is that?
helper,because you're not evolved enough for that. that'd be giving you too much credit.
simon,gassppp. you think im stupid? that's pretty rude!
helper,"you're smart, but ignorant and comfortable with your nasty, backwards and lazy thinking."
helper,you'll never change because you are convinced you are right about everything.
helper,"but maybe one day, youll fuck up and something horrible will happen to you that you didnt forsee. "
helper,you will be so in shock you wont be able to laugh anymore. at anything or anyone. 
helper,"and i hope you will feel guilty for all your crimes, simon. or, at least, so trapped in a void of your own self pity and pride, that you are truly miserable. and bored. and it will be all your fault."
simon,oh wow.
simon,huhh? what the hell is going on? lol
simon,i gotta go on a walk through the woods more often! this is too much!
simon,"i gotta say, though. are you sure your'e not just spitefully projecting your own insecurities here? i mean. all that was pretty weirdly specific."
helper,"you should listen to my warning, simon. its the only one you'll ever get."
simon,oooh! how charitable! and creepily foreboding! what a good helper you are!
simon,you know what you sound like to me? the fun police.
simon,"last i checked its not a crime to laugh. at anything i want to. so really. why should i have to feel ashamed for it? 'cause its ""bad""?"
simon,would refraining cause my actions to become any more or less what they are? no way! it doesnt do anything. whether you like it or not. sorry!
simon,"besides, i cannot help but wonder what exactly is it that i've done here that's ""wrong""?"
helper,hi! you fucking murdered me!
simon,ok yeah but. you're still here. why
simon,if you got killed then how can you be talking to me and getting all offended by what ive done!
simon,"who got murdered, huh? was it anyone at all? your spare parts? i dont get it"
simon,were they like your siblings? duplicates? are all helpers one collective sentient force? or is it more like a metaphorical thing.
simon,"its upsetting and insulting because they were helpers like you are, but it wasnt literally you who died, otherwise you couldnt be standing here right now."
simon,or maybe im more drunk than i thought and this is all just a hallucination
simon,"guess that would explain how you know my name. not to mention, you're clearly more articulate and aware than helpers are supposed to be."
helper,"i could be a ghost of your repressed conscience, simon."
simon,pbbbt. no way. that's definitely not it.
helper,drat. and i was so close to tricking you!
helper,"oh, if only you were able to empathize with a being other than yourself for one fucking second! you must be just too above that! "
helper,what a wickedly evil monster you are! im impressed!
simon,"evil. ""monster."" i suppose normally i wouldnt debate it but"
simon,"im a little bothered by something here. do you think you're better than me, helper? with stronger, less flawed morals? what is it you want from me?"
simon,"for me to challenge my thinking? ok! i can be flexible. but, before that, newsflash!"
simon,you do realize its technically not illegal to dismantle a helper anyway. 
simon,"under the eyes of the law - i committed no crime. even if it might hurt your ""feelings."" that's how it is."
simon,"the ones who decided that law are the humans! the beings you listen to and obey. without question, total loyalty. no problem."
helper,the helpers dont have a choice.
simon,and why is that? why don't they?
helper,that's how they are made.
simon,exactly.
simon,"helpers are constructed. made - not born. they are talking, obedient dolls. helpers are considered property, like a car. less sentient than most household robots or other artificial intelligence. why is that?"
simon,"when a helper commits a crime, is it their fault? no. because they dont have a choice. someone gave them the order to do it. so its that person's fault. "
simon,the helpers cannot be responsible for their actions because they are a tool. not a person.
simon,"they dont care. emotions, fear, pain. they dont feel anything at all."
simon,"hell, i even told those helpers i bought to go if they wanted. i warned them that they would probably ""die."""
simon,they didnt mind one bit. helpers dont get upset even when theyre being ripped apart.
simon,they know it is going to happen when their bodies run out of batteries anyway. its not like it hurts them at all.
simon,but i dont need to explain all that. shouldnt you already know?
simon,or are you different from them somehow?
helper,no. im nothing special
simon,so you're just faking it? you dont even care about all of this?
helper,something like that. yeah.
simon,"huh! what a surprise! somehow, i didn't think you'd admit it so easily"
simon,"you're pretty good at acting all melodramatic. its an even better performance than my ""scary edgy villain"" one. bravo"
simon,"maybe next time ill play your role! i bet i could pull off the ""plight of the non sentient"" really well if i wanted"
simon,anyway! that being said i see no reason for me to continue to participate in this strange charade.
simon,"so, see ya!"
helper,wait simon!
simon,what is it?
helper,"you dont get to just walk away from this, you smug asshole. we're done when i say we are!"
simon,uuughh are you kidding me
helper,no. i am not.
simon,what the hell do you want from me? why are you here? revenge? just get on with it! i dont have all night
simon,"because otherwise we're just perpetuating an ingenuine, pointless conversation about these fake dead people that got pretend murdered! that neither of us care about"
simon,as you just admitted that you dont
helper,why do you think the helpers are fake people?!
simon,"oh, what, you want me to list more reasons besides the ones i already discussed in detail?"
helper,they still died and you laughed about it
simon,what died! you still have yet to freakin' explain that to me! tell me what it was!
helper,id be more inclined to tell you if you managed to produce even a sliver of sympathy for who you hurt.
simon,"what, like a heartfelt apology?"
helper,it would be a start.
simon,ahh oh god! i said it! ohh fuck fuck aaaaaahh
simon,my cold dead evil heart it burnsss
helper,wow! i cant tell if you're trying to apologize or shit yourself.
simon,dont you know? i cant poop. ever
helper,what a shock. i cant either!
simon,haha! wowie
simon,"i didnt know we had so much in common! but i guess that would make sense, wouldnt it?"
helper,and why is that?
simon,"well, its sorta like how they say"
simon,you are what you eat!
simon,"you need fuel to power the helper pods. in the past they would use ""kosmic stones."" however, those stones are considered too precious and valuable of a resource. so they were replaced by another more disposable one. hekatons."
simon,now humans use hekaton blood for fuel. everywhere. and in order to create a single helper drone it takes at least two to four entire hekatons.
simon,maybe i killed 30 helpers or perhaps it was 60 to 120 hekatonkheires.. y'know. depending on how you look at it.
simon,"funny note, its only illegal to kill a hekaton if its explosion causes property damage. and since you are considered ""property."" doesn't it mean that you are inherently worth more than me? alive or not, fake or ""real"""
simon,"you're still more of a ""person."" you are part of human society."
simon,i am not. im just a tool. a weapon
simon,honestly stuff like that makes me kinda jealous.
simon,"if you ask me, i think that all of us are terrible monsters."
simon,"you cannot exist without stepping on something else. yet we still believe our perspective is the most important. something ""special."" that deserves to be known. validated."
simon,"isnt that struggle, that common desire we all share, what makes us ""human?"""
simon,"we all fight for that throne. that ""right"" to exist."
simon,such a pity that the thing everyone wants most is made up bullshit.
simon,"there is no ""rights"" or ""wrongs."" just ""mine"" and ""yours."""
simon,you want to be treated with some respect? have justice for your kind? recognition for your suffering? maybe get just a simple damn apology for once?
simon,bitch. meee tooo.
simon,"so which one of us should say ""sorry"" first? because the way i see it is that the ""system"" is fucked. for us both."
simon,so utterly fucked up its hilarious! and damn. i love a good joke.
simon,"sometimes when things are bad and you're feeling so low, that's all you can do. is laugh"
simon,its the one thing they can never really take away from you.
simon,"best part about it, there's no limit to the supply! everyone can have a chuckle!"
helper,there's no limit to your supply of annoying garbage that spills from your mouth.
helper,what the fuck are you even babbling about? are you just talking to yourself?
simon,"yup. cause you're like, a dead murdered ghost or whatever"
simon,you're not even really here.
simon,i mean. that's the only logical conclusion i can come to because you still wont explain to me what it is you are.
simon,"if you cant tell me that, how am i even going to address you properly in my apology?"
helper,you're going to apologize?
simon,oh! there it is again! that mysterious voice! if only it had a name!
simon,"oh well, must be just my imagination."
helper,how's that for imaginary?
simon,"careful, helper."
simon,that stuff tends to get me pretty hot and bothered.
helper,you're disgusting.
simon,yeahh that's totally my thing too. 
simon,this is torture
helper,cant you take anything seriously?!
simon,hey! i was trying to be earnest with you a moment ago for real! but instead of giving me your name you spat on my face!
helper,you deserved it.
simon,i did didnt i. ive been a baadd boy
helper,earnest. you really expect me to believe that sad attempt was something genuine?
simon,"well it was! ive just never said ""sorry"" before! its hard"
simon,im not even sure i can
helper,what.
simon,after all of the things ive been through no one has ever apologized to me for them! or cared
simon,im not sure how this stuff is even supposed to go?
simon,"ok, wait not 100% true. one person has cared and apologized to me, but most of the time he doesnt really use ""words?"" its tough for him too."
simon,he tries for me though. that's what matters and makes it work
simon,sometimes i can make him upset. i want to fix it so bad and right away that i panic too much to know what to say or do
simon,"he ends up comforting me instead, then we figure it out together"
simon,maybe itd be good? for me to practice saying these kinds of things to someone before i mess up really bad? it could happen
simon,im a terrible guy. and deep down im an even more terrible guy so
helper,yes. ive noticed.
simon,"yeah! but you see! this way, im not intimidated or scared of hurting someone i deeply care about!"
simon,you're just a total stranger! so it could work
helper,oh my god. i think you are actually being a little honest with me!
simon,ohohoho! i bet you didnt expect that! not from someone like me huh
simon,i tooold you i can be flexible with my thinking! arent i the coolest
helper,dont give yourself so much credit. you havent even done anything yet. 
helper,im sure you have ulterior motives.
simon,who me?
helper,"yes, you. you're up to something, faker."
simon,nooo im not! does this look like the face of a liar to you?
helper,yes.
simon,im not faking! cant you see it in my sweet innocent eyes? my intentions are wholesome and pure
simon,i want to be able to change! for the sake of my one true love
simon,he literally means everything to me
helper,intention does not matter for shit!
simon,"hey wait! i can use that ideology in favor of this situation, cant i"
helper,fuck
simon,yaaaay! this is great! im going to be able to say sorry! before anything bad happens!
helper,"hello, dievas. so where are you hiding your sisters?"
helper,"come on, you can tell me. we're friends! right?"
deivas,feh! friend? what a joker you are
deivas,you are not my friend! no! friends dont do the things you do! so dont even pretend such a thing
deivas,what you do is trick and lie and hurt me so so so many times!
deivas,i have the marks on my body to prove it
deivas,you human and your horrible violent little strange smiling humans that all look like you and hurt me and and and i hate them!
helper,"we're not humans, silly! we're helpers!"
deivas,oh golly! yes my mistake. how stupid of me
deivas,"you you ""helpers"" are the the humans without hearts"
deivas,somehow a creature exists that is more annnnoying than a regular ugly human
deivas,we cannot hear your thoughts or sense your true feelings
deivas,that is why
deivas,you are able to sneak up on us and lie to us and hurt us and do all all all sorts of of terrible things! i hate you!
helper,awwww~! somebody's extra grumpy today! isn't he?
deivas,dont you dare speak to me with a condescending tone
deivas,i might be a child but i can still understand a great deal many things! things such as injustice! and i curse you
helper,ohhh! how scary! what kind of curse is it?
deivas,i am not sure yet but when i think of one it will be very horrible
deivas,consider this your last warning. stay away from my sisters
helper,actually! im not here for your sisters today. so you're in luck!
deivas,huh? you're not?
helper,nope! i came to get you! its time for your check-up!
deivas,why would you need to do that? i am perfectly healthy!
helper,"dont try to hide your ""spot"" from me, silly! its a little too late for that anyway! we already know you're sick! let us help take care of you and your disease!"
deivas,no please
helper,let's go for a walk!
deivas,unhand me at once
deivas,"you cannot take me! i, deivas, refuse to leave! i will curse you"
ash,"helper, what is the meaning of this"
ash,"i thought i told you to bring me the ""a-type"""
helper,that is what i am doing! he is right here
ash,that thing. are you sure?
helper,yes!
helper,"oh this is so risky, im scared. what if they find out what i did? what would galore do in this situation?"
helper,no! stop that! i made a decision! about who i am and what i want to do! im not hiding anymore!
helper,it might not make sense to others but! i am still galore!
helper,do you hear me! i was and i will always be! galore!
helper,nothing can keep me from my sweet crimson! not even death! ill always find a way back to her! my love is that strong okay! and! i dont care if anyone believes me or not! you cant stop me! i wont rest until she is finally happy!
helper,well maybe part of that is a little bit of a lie
helper,i do care. i want crimson to believe im galore.. it would make me so very glad!
helper,over 500 years have passed since we were last together
